{
  "version": 2,
  "workflowId": "wf_map_status_label_with_switch",
  "name": "Map status label with switch",
  "steps": [
    {
      "id": "step_map_status_label",
      "type": "deriveColumn",
      "newColumn": {
        "columnId": "col_status_label",
        "displayName": "status_label"
      },
      "expression": {
        "kind": "call",
        "name": "switch",
        "args": [
          {
            "kind": "call",
            "name": "lower",
            "args": [
              {
                "kind": "call",
                "name": "trim",
                "args": [
                  {
                    "kind": "column",
                    "columnId": "col_status"
                  }
                ]
              }
            ]
          },
          {
            "kind": "literal",
            "value": "active"
          },
          {
            "kind": "literal",
            "value": "current"
          },
          {
            "kind": "literal",
            "value": "pending"
          },
          {
            "kind": "literal",
            "value": "review"
          },
          {
            "kind": "literal",
            "value": "inactive"
          },
          {
            "kind": "literal",
            "value": "inactive"
          },
          {
            "kind": "literal",
            "value": "suspended"
          },
          {
            "kind": "literal",
            "value": "blocked"
          },
          {
            "kind": "literal",
            "value": "unknown"
          }
        ]
      }
    }
  ]
}
