{
  "version": 2,
  "workflowId": "wf_normalize_customer_id_digits",
  "name": "Normalize customer ID digits",
  "steps": [
    {
      "id": "step_normalize_customer_id_digits",
      "type": "scopedTransform",
      "columnIds": [
        "col_customer_id"
      ],
      "expression": {
        "kind": "call",
        "name": "replaceRegex",
        "args": [
          {
            "kind": "value"
          },
          {
            "kind": "literal",
            "value": "[^0-9]"
          },
          {
            "kind": "literal",
            "value": ""
          }
        ]
      }
    }
  ]
}
