{
  "version": 2,
  "workflowId": "wf_combine_contact_emails",
  "name": "Create contact emails column",
  "steps": [
    {
      "id": "step_combine_contact_emails",
      "type": "combineColumns",
      "columnIds": [
        "col_email",
        "col_email_2"
      ],
      "separator": " | ",
      "newColumn": {
        "columnId": "col_contact_emails",
        "displayName": "contact_emails"
      }
    }
  ]
}
