{
  "version": 2,
  "workflowId": "wf_sort_customers",
  "name": "Sort customers",
  "steps": [
    {
      "id": "step_sort_customers",
      "type": "sortRows",
      "sorts": [
        {
          "columnId": "col_sign_up_date",
          "direction": "desc"
        },
        {
          "columnId": "col_last_name",
          "direction": "asc"
        }
      ]
    }
  ]
}
