{
  "version": 2,
  "workflowId": "wf_keep_rows_with_email",
  "name": "Keep rows with email",
  "steps": [
    {
      "id": "step_keep_rows_with_email",
      "type": "filterRows",
      "mode": "keep",
      "condition": {
        "kind": "call",
        "name": "not",
        "args": [
          {
            "kind": "call",
            "name": "isEmpty",
            "args": [
              {
                "kind": "call",
                "name": "trim",
                "args": [
                  {
                    "kind": "column",
                    "columnId": "col_email"
                  }
                ]
              }
            ]
          }
        ]
      }
    }
  ]
}
